,Titles,Posts,Author_Self_Descript
0,Please Read New Rules for /r/backpain,"Hi everyone, I have taken over /r/backpain and hope to make it a better place! Please read the new rules for the sub here:

**1. Giving/Asking for Medical Advice**

No users have been verified as doctors, so nobody here is qualified to give out such advice. Even so, back issues are very unique and complex. They require a full and proper assessment, something of which cannot be given over the internet by a stranger. I know some are doing so in good faith, but giving improper advice can be dangerous. 

Be careful of the information you find here, take everything with a grain of salt, and talk to a medical professional if you have any questions.

This does not apply to sharing personal experience or tips and exercises for general fitness.


**2. Advertising**

No advertising is allowed, do not use this sub to post about your products, they will be removed


**3. Unapproved Study**

No posting surveys or searching for participants for your research without contacting a moderator first.


**4. Drug Seeking**

Looking for information on obtaining medications is not allowed.


**5. Creating Drama**

Keep the drama to a minimum, we want helpful and constructive conversations here.


**6. Spam**

No spamming your blog posts, they do not lead to meaningful discussions.


If you have any questions about the rules, please post them here.

Lastly if you are interested in becoming a mod, or helping to build the wiki please let me know!",
1,The First Steps For Dealing With Back Pain,"Do you have back pain and you're not sure what to do? Maybe you think you have exhausted all of your options, tried everything and you just aren't making any progress. Here are the steps we recommend if you have developed back pain, either acute or chronic (we are not doctors, this information has been gathered from research and personal experiences):

**1. See your general practitioner**

It is always a good first step to see your GP whenever you face a new health problem. When it comes to back pain they may recommend you to a specialist, suggest medication, or have you get an X-Ray or MRI.
Although you may not think your GP will be the best help, it is an important first step to let them know your situation, and that way you can rule out other conditions that may be causing the pain (such as a tumor).

**2. See a Physiotherapist**

The next step after you have ruled out the possibility of anything outside the realm of muscular or spinal problems causing your pain, is to see a good physiotherapist. Now we recommend physiotherapists over other specialists because they have the necessary skills to access your back problem, provide manual and physical therapy, while working with you to get better. The best physiotherapist will give a thorough assessment, explain what is wrong and what they are going to do to help you get better, then they will lead you through an exercise routine, may perform some manual therapy, and give you exercises to perform at home.

**3. Read [Back Mechanic](http://www.backfitpro.com/books/back-mechanic-the-mcgill-method-to-fix-back-pain/) by Stuart Mcgill**

This amazing book will provide you with everything you need to start healing your back pain on your own at home. From basic anatomy, to finding your pain triggers, to building your own recovery plan and exercise routine!

**4. See a [Mcgill Method Provider](http://www.backfitpro.com/backpain/provider/)**

A Mcgill Method Provider is a medical professional who has worked with [Professor Stuart Mcgill](http://www.backfitpro.com/about-us/); an esteemed back expert in the world of Biomechanics. Most of the time you are sent for an assessment by a clinician, but you can contact your nearest provider if you are interested. 

**5. Further Research**

The best thing you can do for yourself when suffering from back pain is to learn more about how your body works. We recommend any of Stuart Mcgill's books. Search for research studies, and fact based books from reputable sources. There is a lot of good information out there, but there is also a lot of bad stuff too.

Any steps you think we missed?",
2,Anyone have any tips for lower lumber back pain and how to deal with sitting/resting in the evenings?,"I have muscle/joint damage and arthritis in my lower back. Currently nearing the end of tapering off my 4 years of pain med addiction and getting into yoga and dieting. I tend to sleep long hours. Like 10 a night (got a sleep clinic booked in a month). But I try to be active in the day and stay as true to my daily routine with a fair amount of walking with my dog. Come evenings tho I like to read or watch tv/play a video game. But I cannot find any way to sit that doesn’t aggravate my pain. Which sometimes just leads me to lay down in bed. Which is bad I know. Coz that leads to different areas to flair up. I’ve been through different arm chairs/couches etc. Maybe there’s nothing that is gonna work. 

One bonus question. My mattress is kinda soft. Should I invest in a hard mattress? And try and sleep on my back? I sleep on my stomach. But could learn to sleep different. 

Anyway. Thought I’d ask coz searching around I’m not finding much from people with experience. Cheers! ",
3,"Brazilian Jiu-Jitsu sparring last night, now I'm super stiff","I haven't been doing it that long but I notice that when I do I tend to be super stiff the next day, especially in my back.

For those of you unaware of what Brazilian Jiu-Jitsu is, it's a combination of wrestling and submission, you spend a lot of time on your back and one of the main components of wrestling is to try to lay all your weight on a person to stop them from moving. Super simplified but I hope that explains an idea of what I go through.

I feel as though between my spine and back there's like a soft liquid sack, usually if I drag my fingers down my spine, I can feel it through my skin but right now I barely can. My neck feels like it's constantly being pushed forward as if my body is trying to turn into Mr. Burn's posture from the Simpsons. 

I'm sure in a day or two it will be fine, possibly even faster if I put an ice pack on or take a hot bath but I'm just looking for information on if this is something I should be really concerned about or just something where I should take things easy for the next couple days. ",
4,Getting rid of my old oxy 30s cheap,Dm me or wickr me noddingforfun. Selling my old oxy 30s cheap. ,
5,Lower Right Side Back Pain for Three Weeks,"I injured myself in a crossfit class while doing box step-ups.  The pain happened on the lower right side of my back, but then sub-sided and came back a few days later.  Again, the pain went away, but came back and stupidly, I continued to workout until one Saturday I was in too much pain.

It hurts when I sit, stand, bend over or am sitting in a certain position.  At first I thought it was my SI joint and I went to a chiropractor for adjustments and was prescribed roboxin and naproxen.  That seemed to be helping, but last week, I did some elliptical work and woke up in pain yet again.

I went to a pain center and got trigger point injections and zanaflex (I'm out of roboxin now) and those do not seem to work.  The chiropractor at the pain center says I sprained my back and the issue isn't my SI joint, but rather my L5S1 disc.  He also adjusted me, but I feel like he left me worse for ware because when I woke up the next morning I was in even more pain.

I managed to get predisone (I haven't taken it yet) and want to get a cortisone shot, but some friends have been saying its not necessary and that I just need to rest.  I'm just in a lot of pain and want to get back to being active.  

Anybody have any experience with a similar injury?",
6,Seeking advice on sharing our journey,I have gone through chronic pain for a very long time. I'm trying to share my family's journey (real &amp; fun times) on youtube. We are enjoying it but I'm looking for advice to b/come better. https://www.youtube.com/watch?v=CzcmDmpMbsw&amp;t=0s&amp;list=PLlBrIFCxviT9w8A9WuyiNh35R3tiho8bU&amp;index=5,
7,Foundation training - ankle pain,"I recently discovered Eric Goodman's 12 minute video on foundation training and after doing a few times I can see where the beneficial effect for the back could come from. I have noticed that after the workouts though, I have had some pain in my ankles on the side of the ""ankle ball"". It happens when I extend my legs out into a wide stance. Has anyone else had this issue? What have they done to remedy it?﻿

[https://www.youtube.com/watch?v=4BOTvaRaDjI](https://www.youtube.com/watch?v=4BOTvaRaDjI)",
8,Putting a pillow under my butt,"I don't know if it's my mattress, or what, but as soon as I hit the bed, my lower back hurts. I just now put a pillow under my butt and it immediately relieved the pain. Am I going to regret this in the morning? What's going on here?",
9,Back Pain Remedies at Roseville Disc Center," Roseville Disc Center offer results-oriented [back pain remedies](https://rosevilledisccenter.com/back-pain-remedies/) that help in bringing a marked improvement in the condition of the patients. One of the treatment options available is spinal decompression. It is a non-invasive and non-surgical procedure and ensures effective and safe treatment for the problem. It has been proven effective in relieving the pain associated with bulging and herniated discs, degenerative disc disease, sciatica, and even relapse or failed back surgery. For more information, please visit our website.",
10,Spasms,"In June of 2017, I was playing basketball with some friends in the drive way. I jumped and came down on my leg weird and it felt like my back exploded... prior to this incident my lower back had felt weird (don’t know how else to describe) when standing for a period of time. I’ve had lower back spasms since then and it comes and goes with each time having a different level of pain. I’ve been to physical therapy which had no help. Please help I’m only 17 (6’4 220lbs) and I’m playing varsity basketball this season and I don’t want to have any setbacks.",
11,Back Pain Days After Hockey - Worried I Have To Quit,"Hi. I am looking for some advice. Sorry if this is the wrong place. I am 33, 6'3, 235lbs. I fell in love with playing hockey two years ago. This January I started having very bad back pain set in 1-3 days after playing. I feel great when I play. I usually feel great for the next day or two. But then my very lower middle of my back starts getting very sore. At times it can be incredibly bad. It will radiate into my hips and butt and linger for weeks. Needless to say I haven't been playing very often. I have asked my doctor and had no real help. She put me on anti- inflamatories and I started doing lots of stretches she recommended. But still last week I tried to play after feeling good for a month and now I am hurting again so bad. Im not sure what it could be. I hate to think that after finding hockey I will lose it this quick. It makes me feel so great to go out and play.",
12,"If you're using NSAID (Ibuprofen,aspirin,aleve,naproxen) chronically - what's your schedule and dose?","Hi,

Ibuprofen makes night and day difference for me. I take 400mg, 4 times per week (leave 3 sequential days without them). Unfortunately I do not have access to doctor. I've heard NSAID are bad long-term for multiple reasons. Anyone using them regularly? What's your dose? 

&amp;#x200B;

Can you take them safely if you schedule several days in a row without them?",
13,"""Back Pain Doctor In Dwarka"" | Back Pain Doctor | Dr. Arun Bhanot","Dr. Arun Bhanot, the best back pain doctor in Delhi,Gurgaon, is a renowned spine specialist who treats all kinds of pain and problems related to spine.  [Best Doctor For Spine Surgery In Dwarka](http://drarunbhanot.com/)",
14,This Inexpensive Product Is Helping Me Recover From My Spinal Fusion - I Have Included My Personal Story Here,,
15,Lower back pain (again),"Basically I've dealt with lower back pain on and off for years now (I'm currently 32). However over the last several months the periods of pain have been happening close together and lasting longer.

I'm not good at describing pain so bear with me. It's the middle of my lower back, definitely deep inside, it's a weird numb/burning/tingly feeling mixed with sharp jabs if I move the wrong way. Sometimes I'll get a radiating pain down my right hip/thigh/leg and my knee sometimes randomly buckles out of nowhere. On a scale of 1 to 10 I can feel it slowly starting as a 1, build up through the day, and I'm close to a high 7, sometimes pushing low to mid 9 by bedtime.

The pain will stay for a few days, previously would be a day or two, but my recent ""episode"" a few weeks ago lasted close to a solid week. Now it's happening again. It started yesterday and already today it feels more ""advanced"" by day 2 then it did last time on day 2.

Sitting is almost impossible, walking/standing sucks, but is better than sitting. Forget bending down, insane pain, nothing I take OTC touches it. Biofreeze works for a little bit. I get some relief by laying on my back and putting either a pillow or a rolled up blanket under my hips. I'll instantly feel somewhat relief when I do this, although the pain is never gone.

Some back story on me. Starting when I was 15 I went through several knee operations due to karate injuries (3 or 4 within 5 years). When I was 21 I had a major work related injury where I fell close to 2 feet straight on my right ankle and pretty much destroyed it. For close to 4 years I went through intense PT and multiple reconstruction surgeries.

I'm concerned that years of constantly walking on crutches and using a cane messed up my back by how my gate and weight distribution was messed up.

Also for work I am a mailman, I walk close to 13 miles a day in a city (lots of stairs), carrying and picking up heavy things all the time.

I really want to go to urgent care after work today, I'm just concerned about getting brushed aside because literally everyone has ""back pain"".

Edit: While walking in general sucks I feel a sharp jab everytime I extend and then step through with my right leg. The pain is constant while I'm up and walking, but there is that jab of sharp pain on the right that I don't get when I step with my left leg. ",
16,Dr said all is fine then asked for records and saw this dont know what it means ugh,,
17,I have back pain after working at a standing desk all day.,"I am using a standing mat. I have a desk extender that elevates my laptop such that I can work on it with my arms at about a 90 degree angle. But, after even a bit of time I start to feel my pack, and constantly need to crack the bottom of it by hyper extending my back.

&amp;#x200B;

For reference, I have had two back injuries weight lifting in the past. But, standing at this desk seems to be the worst thing for my back. For instance, this weekend I swam, wakeboarded, sat in cars for hours, and my back felt okay. But, now that I am back at my desk the problem is back.

Can anyone point me to a good resource for working at a standing desk properly?",
18,Upper back pain for the last 3 weeks,"Hey everyone, will try and keep it brief. 

I'm a 34 year old male who started getting an ache in bottom of neck/top of spine about 3 weeks ago during a week when I was doing more gym work than usual (C5/C6 area) and occasionally across shoulders. 

It’s been on and off since then, sometimes having days where I can have very little achiness, others (like today) can be quite discomforting and painful – I’ve also been feeling pain lower down the back sometimes too. It’s more a dull ache than a sharp pain. 

Also been getting the odd twinge/tingle in little fingers on each hand now and then. 

I don’t have it during the night so am able to sleep, usually wake up without pain (stopped sleeping on my front which may have helped) and take warm baths every night that helps, but I’ve found I’ve been feeling weaker and more tired during my gym sessions. 

I’ve got an appointment booked in with a physio for next week, but wondered if this sounds familiar to anyone and any advice on how to help it – mainly to put my mind at ease since I suffer with anxiety and am imagining the worst. 
",
19,A study shows that lower back pain is being treated badly around the world!,,
20,DDD is now gone,"I'm now 31 years old when I was 18 I was diagnosed with degenerative disc disease triple D with something to do with my L2 L4 something and that my this words deteriorated their rub against each other and then got an x-ray the other the other day just to see how much it's gotten worse and they say there's nothing wrong with me. That I don't have DDD. I'm a a large guy 260 at 6'6"". My back has always hurt I just standing and doing the dishes hurts my lower back so bad sweeping and sweeping hurts my back and I'm not even talking about lifting stuff just everyday How Stuff sweeping and then bending over with a dustpan my back it just makes me want like I don't want any drugs I'm on methadone already. I've abused drugs in the past because of how bad the pain was and the doctors want to do anything and by the time they got me over to payment rent I had already been treated and prescribe Suboxone and right away he looked at my x-ray and he shook his head like oh boy looks like it hurts then he saw that I was once prescribed Suboxone. At that time I was also looking for something like a narcotic but I think instant release Percocets but now I can't get out of bed when I do try to get out of bed it takes me 3 or 4 times I trying to get up off the bed because I usually just fall back down on the bed so I'm wanting to know was the first X-ray tech or whoever reads them wrong or was the most recent one wrong to because if they say there's nothing wrong then why is my back hurts so bad binder I would love to have a surgery wake up and up and be gone

I've also applied for disability but that's not physically you could add to the list but ptss agoraphobic depression anxiety. 

So was my first X-ray tech wrong being completely wrong could my second most recent X-ray tech we also wrong and that I'm perfectly fine and if there's no pain whatsoever suggestions please",
21,"Spinal decompression side effects, what is your experience?","I replied to another comment earlier but decided to make it its own thread.

I've had two flare ups caused by a bulge in L5S1.

For the first flare up I went to see a physio, he ordered an mri that revealed a bulge and we got to work. We did a few rounds of decompression wich worked fine. It's difficult to say if it was the decompression or all the exercises I was doing. Anyway, a couple of months later I was mostly pain free, and remained that way for almost a year. 

A couple of months ago it flared up again for some obscure reason. I went to see the same psysio and we got decided to use the decompression again. I felt fine after a couple of sessions. After the third session I was absolutely ruined in my upper back, where I've never had any pain before. I could barely stand for the rest of the day and went straight to bed. It went away in a couple of days but it was properly scary. We decided to discontinue right away. I think the therapy decompressed my upper spine too much, causing pain. 

Has this ever happened to you when you've done some form of decompression? I can't find any literature on this side effect. Whenever I Google ""spinal decompression + anything"" all I find is quack articles dismissing any harmful side effects completely.",
22,Burning and numbness on one point in upper back.,"For over a month now, I've had a burning pain in just one point right under my left shoulderblade. It varies from a mild discomfort to sharp pain, and it seems like when I touch it there's a quarter-sized area of skin that feels sort of numb. When I touch it I feel pain under the skin, but not my finger running over it. My doctor sent me to a dermatologist just to double check it wasn't a skin issue, but she's thinking it's neurological with the nerves. Has anyone else had this issue?",
23,Subtle back soreness and discomfort not going away,"Hi everyone, I have mild scoliosis who I’ve seen a doctor for. He said it’s pretty mild and shouldn’t be bothered by it for now and for the most part Scoliosis hasn’t had a big impact on me in my life in terms of pain. I work as an occupational therapist (I know great career for people with back issues), and the last couple months the right mid and upper side of my back where the curve goes away from, I’ve had this annoying soreness that’s been lingering for several weeks now. I don’t remember picking up anything wrong. I do remember doing intense back stretches in my dance class at that time but wouldn’t that have gone away by now? Anyone know what this could be? ",
24,"Anyone have any tips for my mid, upper back pain or know what it is? I'll try to be very brief.","-hurts mid upper back usually in between the lats and spine, sometimes more left, sometimes right and occasionally around the shoulder blades too

-had it on and off, mild to bad for like 8 years now

-triggered by standing a lot all day, lifting insignificant things (randomly not always)

-the pain varies from sharp and a pulling feeling to an also sharp but cramp-like feeling

-back feels better after sleep and best in the morning 

-prone to COMPLETELY throwing back out and not being able to work or even move sometimes for a couple of days (although this only seems to happen twice a year)


I've had pain free periods but recently I haven't had a completely pain free day in almost 2 years. this leads me to believe recovery is possible but I have no clue how",
