,Titles,Posts,Author_Self_Descript
172,Lower back pain / right shoulder pain that stops when I press my lower back against the chair's arm rest. Why?,"Hi guys,

I have had for years (15?) pain in my right shoulder. I think I got this when swimming when I was younger. It has all the symptoms of a rotator cuff injury. I went to the doctors and did X-ray and MRI but they tell me there doesn't seem to be anything too wrong with my right shoulder. Depending on some factors, the pain can happen in my shoulder or anywhere in my right shoulder / upper back. The pain of course gets a lot worse after doing weight lifting, especially with training that involves raising my right arm.

I've recently noticed that leaning my back against my chair's arm (a hard surface) hard makes the pain immediately vanish. At first I thought it was just about ""helping"" my back acquire a good posture /  finally giving some rest to my back's muscles but now I'm leaning towards another possible explanation -- what if by doing this blocking some nerve that's responsible for the pain in my upper back?

Could anyone shed some light in this? I have almost no flexibility in my lower back (I'm light years away of being able to touch my toes with my hands, for instance), and very frequently, if I'm not careful when picking stuff from the ground, I get pain in my lower back for a couple of days.

Thanks",
173,Tingling on the back of my head..,"Hi guys, 
I'm new to this sub. I was involved in a pedestrian hit and run years ago and I have back problems now.. Can you believe it? Haha. I have been diagnosed with degenerative disk disease, sciatica, I have a rib that pops in and out and arthritis to top it off. I have a nerve conduction test coming up this month.. I've thought I've had never damage since 2010 when the car hit me. I guess I just wanted to ask you guys with back pain if they ever experience this crazy tingling/pins and needles feeling in the back of your head. Anybody? It drives me nuts and will last more than a week sometimes. I have other nerve issues too, but the tingling on my head is CRAZY and really makes me not want to do anything. I'm reading through Google right now, but I do that all the time and it usually just makes me nervous. Haha. Does anyone here have this happen to them? If so, have you been able to stop it or talked to a doctor about it? Like I said, I have the nerve conduction study coming up this month.. I was looking for anyone else with the same issue to talk to, I guess. I'm thinking if I talk to more people a light bulb could go on for me and it might help me talk to this specialist I'm going to see. 

Anyway, thank you for reading this and letting me ramble a little bit. Thanks in advance for any advice!",
174,"Voltarol, ibuprofen gel, hot balm, cold freeze - which one?","Any suggestions, I can't paste them all on",
175,Squat caused back pain,about one month ago i was squatting and during my second set I felt something pop and I stopped lifting. Next day I started feeling pain on my lower left side right above my hips. If I do squats or deadlifts now it seems to make the pain go away for a day but then it returns. I've done some exercises I've found online and some yoga although only for 5-10 minutes each time. Also sitting for long periods of time make it worse while standing or laying down seem to make it feel better.,
176,"Increasingly bad back pain for over a year, I cant find any form of pain relief and I think the issue may not be my back but a symptom of something else.","tl;dr bad back pain, I think I was misdiagnosed for possible kidney disease or endometriosis and im scared my mri will turn up with nothing and ill be back to square 1.

If it helps I'm 24f 5'2 and my weight is between 95-105 pounds. Generally I was a very active person before the pain got to bad, to my knowledge I have not injured anything.

My chronic lower backpain started a year ago. I had some things ruled out but im scared they were really just over looked. I had appendicitis while in the hospital overnight i peed like 10 to 15 times and when i go its a very little amount but I have to do it my bladders not full but its to much pressure for me and it hurts and they told me It wasnt normal to pee so much but I told them that it was normal for me I pee that much every night at home so they did a quick ultrasound but said everything looked okay. After recovery I saw my doctor about the back pain to get it taken care of and mentioned my frequent bathroom trips at night. The pain intensified durind my periods and was always getting worse and lasting longer so they suggested seeing an obgyn for endometriosis. The obgyn did an internal ultarsound and said they didnt see anything weird in the ultrasound and were able to look at my organs and they looked fine. I went back to the doctor for birth control to have the pain managed during my period and had to do a pregnancy test, my urine sample came back funky and they asked me more specifically about my pain. My pain specifically is in my lower spine it starts around the lower portion of my ribs and runs down but its more on the right side, its in my pelvis and sometimes the front of the bottom of my lower ribs but it feels like its underneath it and my actual side, its a dull ache all day that goes to sudden sharp spasms or stabbing pain. I have a family history of kidney disease so they had me come in for a couple more times over the month to do blood and urine tests and then they said I was fine it was probably just one off test that day and my tests were back in normal ranges and that was that. 

I have a new primary care doctor, I just got checked up for my back 2 or 3 weeks ago and told her everything and she informed me you can only be positively diagnosed with endometriosis surgically because an ultrasound cant really see endometriosis tissue. The pain has significantly gotten worse lately. Ive had an xray and the technichian said something about my joints not wanting to open up while taking the side view of the xray and they had to retake the xray mutiple times. My mri is Friday and I'm petrified that they're not even going to find anything wrong and I have this pain for no reason at all. 

My life has been so badly affected by this to the point I just dont want to exist anymore. The past 4 months my body has declined and I feel really useless and terrible and embaressed I dont even want to leave my house. I physically can not bend over and recently the pain from my spine has caused me to start peeing myself a little when im just walking up and down my stairs, jumping, coughing or sneezing and i have allergiers right now so thats just great. I dont even know how to explain it, its just like pressure on my spine and the pain is to intense at some unexpected moments i loose control for a second. Ive looked up online that incontinence can be associated with low back pain but has anyone really ever had that happen to them? And what was your cause of your back pain associated to that? 

I have tried advil,ibuprofen, bayer back and body daily and when they all showed no signs of relief it wasnt worth taking anymore. Ive tried norco which just distracted me a little from the pain but i knew it was still there, i do heat pads and ice, essential oils, special pillows/sleeping positions, stretching and yoga, salt baths and icy hot. I went to a pet shop to hold kittens and it made me forget about it for a little bit and feel better lol anyways my doctor has me on 1 to 2 diazepam every 4 to 8 hours if needed and that also isnt helping at all. 

The incontenince has gotten worse really just the past week with my allergies so I dont want to even leave my house, if I do i have to be careful and be prepared and im embarrassed to even have to bring this up at physical therapy to someones face, which is holding me back from scheduling my appointment. I really just needed to get alot of this off my chest. Im really really scared something is actually wrong with my kidneys and it has nothing to do with my back but im hoping someone else has had some back problem thats caused the same issue and it turned out to be something minor and im freaking out over nothing.",
177,4 Simple Exercises for Those With Chronic Back Pain,,
178,Have any of you got experience with CES?,"TL;DR: CES and leaky butthole. Pls halp. 

Hi all. I'm 8 days post surgery. I had been struggling with a herniated disc for some time and was planning surgery end of summer/early fall to give me time to onboard a fill-in at work and lose some more weight. 

It became an emergency last Sunday, May 20th, when I went numb below the waist after a fall. I was told by the ER to suck it up and talk to my neurosurgeon Monday. He diagnosed me immediately with Cauda Equina Syndrome, and sent me to the hospital for an emergency discectomy. I was released home Friday. 

I still can't feel my feet, calves, hamstrings, glutes, nor any of my private parts. I'm wondering if anyone else here had this with CES, and how long it took to regain feeling and control, if any. Right now I have a Foley catheter in and every time I sit on the toilet I leak poo since I can't control my butthole. I regularly sit on the toilet for 1-2 hours and still can't get clean, and it's driving me crazy. 

If you had a similar experience, I'd appreciate any tips, tricks, or advice you may have. 

Thanks for reading. ",
179,Back pain??,"Have had absolutely terrible pain in the right part of my back when I lie on it the past few weeks. It's a real bummer because that's the side I sleep on, but now whenever I lie down in any position for too long, I get the same pain in the same spot. It's sort of the middle area of my back, on the right side, in between some ribs it feels like. But it's painful enough that once I wake up, I can't go back to sleep. Thought it was my mattress, so I've tried a cheap mattress topper and a pillow underneath my back, but nothing has helped. Currently fighting some kind of cold, so any ideas as to what's causing this would be appreciated!",
180,Back pain and posture,"Back pain often gets coupled with poor posture. Postural adaptions occur due to habits or movements performed with any frequency. Just some thoughts on posture and it's relationship pain and function.

[https://mindmattermotion.blog/blog/](https://mindmattermotion.blog/blog/)",
181,Backpack vs Laptop case for back pain ?,"What's generally the best solution ? \(I know it depends on cases, but let's assume I have no particular problem\) 

I feel that laptop case is asymetrical which isn't great but you can switch sides. But I feel that I walk but a better back alignment when I use laptop case

What's your opinion on this ?",
182,My Back Pain Traveled Up to Middle of Spine Any Suggestions On What This Might Be?,"Hey guys,

First time posting on this sub but a long time lurker. So I had an MRI back in December of 2017 and the findings were, a L4-5 Posterior Central Bulge. Some other details are included below.

+Canal and neuroforamina are patent.

+L5-S1: Extruded broad-based central, left paracentral disc herniation with caudal migration of disc material without sequestration. The herniation posteriorly displaces and impinges the traversing left S1 nerve root.

+T12-L1 through L3-4 disc levels are normal. Conus terminates at L1 without signal abnormality. No intradural mass lesion.

+Vertebral alignment is anatomic. No vertebral marrow edema, infiltrative marrow process, fracture, anterolisthesis, intraosseous lesion or facet arthrosis. Paraspinal soft tissues are unremarkable.


Since them my sciatic pain has gone down to almost nothing but now I have pain in my middle back of my spine. I have been super fragile about everything and have strengthened my core a lot, sleeping habits, eating habits, and bending habits.

Is it possible that the disc material is traveling up my spine? I just got blood work done last week and it was normal. I am going to see a new orthopedic this week also.

I have no clue whats going on with me, it sucks and I'm tired. Any suggestions, advice, or experiences would be greatly appreciated. Would love to hear anything. Thanks for taking the time to read my post.

EDIT: I don't know why I can't make bullet point in the post, I tried the formatting help on reddit and it's not working. Plus signs will have to do.",
183,Backpain. Feel relief when I am in fetal position &amp; or have legs up in front of me,"I went out hiking a month ago, 11 miles  and upon return had noticed some lower back /hips/tailbone pain. It was a tough hike that I was not ready for, not sure if my body mechanics were in tune.

I now only feel relief when I am laying down in a somewhat fetal position. Since this injury, I have been taking a lot of easier hikes.",
184,Anyone Know If Wearing a Brace Would Help For Lumbar Hypolordosis,I've been experiencing a lot of pain lately while working and am wondering if buying a brace for the area would help. Thank you,
185,Best sleeping position for upper back pain?,"We spend 1/3 of our lives sleeping and proper sleeping position should's be overlooked
 https://sleepinglucid.com/best-sleeping-position-upper-back-pain/",
186,I found something that helps with my back pain,"I’ve been struggling with back pain for 15 years. All the doctors and physical therapists told me I had extremely tight hamstrings, but any stretching program we tried increased my pain to the point we had to stop. 

Last year I bought a pair of lace-up cowboy boots (Ariat Heritage Lacer). The elevated heel takes tension off my hamstrings and makes a *huge* difference. It doesn’t fix my problems by any means, but it allows me to walk much further without pain. Maybe this can help some of you as well. ",
187,"Suffered low back pain since 2015, local doctors did not help and then recently I found this video.","https://youtu.be/DWmGArQBtFI

Meds and exercises didn't do much for me, having low impact or no impact at all, so I thought that i must exercise for a long time just to live tolerantly.

Recently I accidentally stumbled upon this video, tried this exercises a bit and it worked like a charm. Dull pain stopped immediately and on next morning I woke up with no pain even considering that I did exercises only 1 time before sleep.

Now I think that problem was not with  spine.",
188,I need a bit of advice! L4-L5-S1 hernias,"Hi guys, first time poster here, first time I've ever been here.

Today I came back from my doctor's from some back pain and radiating pain to my left leg, with the diagnosis being herniated discs that are causing my pain and al the ""cracking"" sound I feel sometimes as I twist my back.

Some information about my build: 31y/o, Male, 2.02mts tall, 67Kg, I'm on the light side of the scale, but I exercise regularly, so I'm 0% fat, just sweet muscle and bone. Yes, I'm pretty thin, but at the sme time super strong, like I can lift a washing machine all by myself and carry it around.

Always have been the ""if it doesn't need stitches, then no medic"" kind of guy, always braving stuff up. I have had the worst migraines since I was 12, plus I've got some mental condition that basically sometimes replaces my rational thinking.

I am the go-to guy for physical projects, but am also an architect so I spend a lot of time sitting be it on my computer or my drawing desk, again this information is important.

Me, being the tall guy in a country where the average height is 1,70M and 1,65F, and growing a lot in my teens, and working with people and being a sociable asshat, always had bad posture, which made me gain the Scoliosis perk. /s So I'm super used to feeling pain all the time and just ""meh"" it out, it's just another stupid day in this broken hardware.

A year back, I was working with my best friend ever on a business venture, making some high-end furniture, and designing a couple projects. All well, until he bought an outdoor springboard. We loved that crap. I loved it, just light up a joint and carelessly jump that dreaded white page sindrome away, it was a nice thinking device for me to unblock my thoughts and sometimes get inspired.

I was jumping and my mate's girl did something where you jump standing, fall sitting and then stand up, IDK if I'm describing this well enough. I was amazed by how it looked, and tried to copy her.

I landed sitting and immediatly felt something in my back broke, I could not stop laughing (that's one of my responses to extreme pain, this was like a 8/10 At the moment) and was crippled for like three hours where I could not stand up straight.

The next day the pain was gone so I brushed it off.

In March, this year, I began feeling some absurd pain on my left leg, a pain that went from my heel, through all my leg, my pelvis, my back, a shoulder and my neck. Like if I moved my neck in some way, I could ""feel like something inside is pulling from my neck to my heel"". Kept brushing it off until one day I could not get out of my bed, that was when I called for an appointment, I never thought it could turn out ""bad"" just a muscle spasm, or something stupid right? Nope, it's what I told you at the start, three stupid herniated discs.

I was asked if by chance I had some bowel issues loss of strength on my leg and loss of feeling in my thighs, all of them where answered positive, I've never related something I thought of as IBS, but it began when my leg started to fail.

The doctor ordered some more x-rays, and told me nothing apart from ""it could be worrying, let's wait for the imaging""

I'm freaking out.

Can someone with more experience in this field, maybe get my hopes high or tell me to prepare for a painful existence now on?

Hell, I hate it, I was told to stop all physical activity, not lifting anything (I love to lift my dogs!) no more woodworking for a while... I'm sad.",
189,Any doctors out there willing to give me advice?,"In 2017 I told myself that that would be the last year that I suffered pain. It is almost the middle of the year and he has the only gotten worse. As of December of 2017 I knew that I had a bad L5. Most recent Amorite revealed eight damage discs. Doctors within the same Medical Group contradicting themselves. I am starting to lose balance and consequently falling a lot. I don't want to keep going from Doctor to doctor and be flag for Doctor shopping. However, I've only had five Dr in my entire life I'm almost 50. I had neck pain for years but never took care of it. In fact I didn't even know painkillers were available at the pharmacy. I thought that they were only to spend so hospitals. That is how naive I was. I have all my MRI reports EMG will everything. Will any doctor out there interpret them for me and gave me their honest opinion? Thank you.",
190,Any tips for people with one leg slightly longer than the other? Causing some pain due to weird hip angle.,"My left leg is slightly longer than my right. Its noticeable without a shirt because my hips are at a slight angle. When I was a teenager (mid 20s now) my doctor noticed it and told me to just wear insoles in my right shoe to counter it. That helps a little but recently I have had more back discomfort and my first thought is that it has something to do with this.

Anyone else have this problem? Any ideas for what to do would be appreciated.",
191,Have anyone tried this device (inversion table) Before and has it worked?,,
192,"Bulging discs at S1, L5 and L4. I suspect my old chair chair (grey) is exacerbating my back pain, so I changed to a new chair (the red one) but immediately felt back pain / discomfort. Does my back need time to adjust to a proper seating posture? Or is this new chair bad for my back?",,
193,Mysterious back pains (see link),"Hello r/backpain!

I have a mystery for you.

https://i.redd.it/kp5f4m3jbhz01.png

I've been having some pretty horrendous back pains for avout 6 years now. It's always been a very diffuse pain and I've had no clue what to do.

A while back I posted about it on a few boards on reddit, and one particularly kind redditor suggested I use a tennis ball to massage the tender spots.

And so I did, lo and behold the pains started disappearing from the spot I massaged! I've encircled the area in question in blue (see link). To be clear, I used to have pains in this area, and after massag myself very vigourously, I now have no pains in this area anymore.

However, once the pains in ths area started disappearing, it became easier for me to localize another painful area, encircled in red. This area hurts like a b***h constantly.

I've been faithfully applying my tennis ball to the area, making my back bruised in that spot (as I did for the previous area). This pain however seems far far worse than the first area. I can't figure out what I should do, should I keep massaging this point and hope the pains disappear from this point as it did for the previous point?

A few bits of information:

When I apply a fair bit of pressure at that point I get an almost burning sensation. Otherwise it just feels aching throughout the entire day, especially if I've been sitting upright for a while.

When I hunch over to pick something up I get a very dull, but very painful sensation in that area.

When I've been massaging it particularly aggressively, the spot sometimes gets a tiny bit itchy.

It very much seems to follow the rib encircled on the image. In fact it seems like it's exactly on that rib it hurts.

When I can manage to get my hand back there, it seems like theres a very tiny painful lump I can move around.

The previous pain also followed the ribs, and as mentioned earlier is almost completely gone now.

What even causes such pains? Am I doing the right thing in massaging the area? 

Any and all advice/help appreciated!",
194,Chronic pain and running out of options...,"Long time lurker, first time poster.  I'm 39 year old male, weight around 160lbs, and in good physical condition.  I've been battling back pain on and off for years but things took a turn for the worst back in 2013\-14 when I was involved in two car accidents \(rear\-ended both times\).  It's mainly been lower back pain with occasional sciatica.  Around Easter I had a fall in the bathroom \(had a bad stomach flu and fell against the toilet hitting the middle of my back\).  I was having a hard time sleeping in the month before that due to terrible pain in my lower back at night \(I'd say a 6 or 7 level pain\).  Now it's more like a 8 or even 9 but in the middle, every night.  Since I've been to my doctor, a physiatrist, and have been doing physical therapy.  In the past I've been to a chiropractor but didn't give me any results.  I've had X\-rays taken and am starting to think I need an MRI now.  The pain is sometimes manageable after I get up and stretch and move around.  I am having pain down my right leg and on the top of my foot with some tingliness.  I've been taking ibuprofen \(any kind of narcotic has given me terrible side effects\), using heat, ice, baths, etc.  Feel like I am running out of options and want to avoid surgery.  Any help or advice is greatly appreciated!  Thanks.         ",
195,Pain near the anus area and Difficulty of bending over,"Hello,

I have been experiencing a very concerning discomfort in my lower back, in the area right next to the anus. From what I can tell it isn't the anus itself but the sacral curve, at least that's what I found from my search in Google. I can feel a swelling, and I have difficulty trying to sit, sleep or in general move my body without feeling pain in that area.
As of late, i've been sitting in my bed for long periods of time while using my laptop, and whenever I felt tired of one position, I moved to another one, then got back to sitting again, and little by little I felt that discomfort growing and growing until I could (and can) no longer sit without feeling pain when bending my spine or bowing to get something from the ground.
Is this related to the spine or to the anus ?

Please let me know.

Thanks !",
196,New company wants me to carry laptop out of hours unnecessarily,"I suffer from lower back pain, it comes and goes for about a month and I have it now.
Will carrying a laptop and bag, over one shoulder be a major problem due to the asymmetry?

I can try and refuse to, but I'm new and don't want to create trouble unnecessarily.",
197,Onset at night of lower right back pain. HELP,"I recently ( past month) have been experiencing 8 out of 10 lower right back pain that wraps around side some, in the early hours of the morning. Originally, I thought it could be a sciatica type pain but it does not appear to fit criteria. It is localized and feels “deep” . It is painful to the point of giving me the sensation to vomit and only heat pad and Aleve take a very small edge off. It’s impacting my sleep and I am unsure who is best to even see about this. Anyone with similar experience or any insight? ",
198,every morning when i wake up my back hurts very bad.,I thought it was my mattress but its not. i cant even lay on my back. for the first like 2 hours of every morning i have to walk around and try to ignore the pain. i have no idea why this is happening. its mainly the center of my back. i have no idea what to do. ,
199,Surgery an option?,"Without going into too much detail, I've had back pain for about 10 months now and have just got the following diagnosis

&gt;Degenerative L1/2, disc disease with L4/5, L5/S1 disc prolapse with annular tear with facet join syndrome.

Struggling to really understand what the problem is though from that. Would a microdisectomy be an option?

Edit: So far I've done PT, Pilates, Swimming and bought a new chair",
