,Titles,Posts,Author_Self_Descript
348,L5-S1 Aggravated or Re-injured,"I had a lumbar discectomy (L5-S1) 7 years ago. As a young adult I've mostly been fine, but 2 weeks ago on a ski trip I may have either aggravated it or re-injured it. 

I'm stretching every day which helps a ton but it seems to quickly come back and bother me. This is unusual given the last 7 years of little to no complications. 

So id like to have someone take a look and provide potential remedies. My trainer mentioned trying chiropractors, but on my original injury, that did absolutely nothing. 

This is a acute pain they feels deep in the glutes. It's definitely that L5-S1. It's not even close to as bad as when I had herniated it 7 years ago. But I also want to get back to where I was for so many months. 

Any tips on what kind of specialist I should see? 

Thanks!",
349,Set aside some time each day to relax to lower back pain and tension.,,
350,Cervical Spine Issues - 3 Events,"Hello!

I'm desperately trying to see what is covered under my medical and get an appointment, but everyone is 3-4 weeks out for an appointment.

I've been a long-time sports enthusiast (snowboarding, kayaking, soccer, basketball, tennis). I'm also a developer who spends 6-7 hours a day at a desk. I'm 29 years old.

Within the past 2-3 years I've had 3 events that have caused me really bad back pain. Once I was snowboarding, another time I was Kayaking (whitewater), and another time I was lifting weights. None of the events were particularly violent or anything. Just typical movements and all of a sudden I feel a sharp pain in my back and its hard to move my head in any direction.

The pain seems to be stemming from the 4th, 5th, and 6th vertebrae that I can feel on with my hand. Leading up to the event I can feel some slight discomfort in my upper back/neck and get a popping noise out of my neck if I try to touch my ear to my shoulder - that kind of movement.

I have a really sore back and limited range of motion for a week and the pain slowly subsides weeks later. I can't turn my head all the way. When I turn to the right I feel pain in my upper back near where the injury occurs. If I turn to the left I feel pain as well, but it's very centered in what feels like a muscle just to the left of my shoulder around the 4th-6th vertebrae down (that I can feel with my hands). Up and down movement of my head heals quicker than side to side.

Let me know if I can provide any more helpful information!

Edit: Additional info: 1st time was Jan 2016, 2nd time was September 2017, 3rd time was Jan 2018

tldr;
3 times now in the past 2-3 years I've had an injury of sorts to what feels like my 4th, 5th, and 6th vertebrae and resulting back pain with limited mobility for a few weeks. Trying to see a doctor, but anyone have any ideas what could be going on?",
351,Backrack - How does it work?,,
352,Backrack School coming to USA soon.,,
353,Lower back pain,Recently started driving lessons and each lesson is 2 hours. Around 45ish minutes into the lesson my lower back starts to hurt and I have to take a break and stand up. Any ideas what’s happening?,
354,Can gabapentin actually regenerate nerves or just helps to reduce the pain?,I hear different opinions constantly; please comment if you have any knowledge or experience in taking this med,
355,Pregnancy Back Pain – Part of the Pregnancy Journey or a Potentially Serious Complication?,,
356,Bones on my spine feel brusied?,Hey! I've have a bit of a weird one for a while. Around my mid back if I touch the bones of my spine it hurts like it's brusied. Also if I slouch over and stretch it hurts. Almost like the skin going tight from this hurts it. I also get pain a bit in the muscles to both sides of where it feels bruised but normally only if I'm sat down and slouched. Just wondered if anyone has had this weird sensation before?,
357,Surgery opinions on multiple herniated discs,"So i was diagnosed with scoliosis at 15 when I started noticing pain in my lower back while lifting weights , the pain and problems related have excelled to an unbearable level , I saw a back specialist last February to review an MRI &amp; discuss my options , this MRI was already a year old and was told I have 4 herniated discs in my lumbar region &amp; they did not want to consider surgery until I had ruptured one. I'm now in Ohio for college &amp; just got a new doctor as well as insurance , new MRI shows every disc from my t11 to my l5:si is herniated , I meet with a neurologist in a little over a week &amp; hearing my doctor &amp; nurses suggest surgery will be the go to has me a bit nervous as my physical therapist that I saw just yesterday for my evaluation says I should avoid surgery as long as possible , I am experiencing a good bit of pelvic tilt , my left leg to my foot is typically numb after transitioning from standing/sitting , obviously a pinched nerve but at times it's a very sharp pain in my left buttock that feels as if I'm getting an ice pick stabbed into my hip from my butt. My hips pop from a simple outward movement of my knee in a seated position as if they are going to dislocate which is painful to say the least. I left school at 14 and began working construction , then onto concrete &amp; excavation &amp; grew up racing motocross as well as playing basketball in 3 leagues so the restrictions &amp; pain I'm experiencing at this age are not exactly surprising but not at all normal. If there's anyone out there that has had back surgery due to herniated discs your input would be greatly appreciated as I do not want to make things harder on myself if I can find an alternative to manage these issues , my major is high performance Motorsports technology &amp; of my classes that involve much labor at all absolutely kill my lower back then I work 10hr shifts at a theatre on the weekends as an usher cleaning theatres. To go through with an operation that might be a bad idea, or try to manage the situation as long as possible risking further damage? Please lend advice!
",
358,Lower Back Pain - help with diagnosis,"So I've had lower back pain which has gradually increased over the last 7-8 years, no accidents or anything.  I thought I'd post a list of symptoms here in case anyone has similar ones and has been diagnosed with something more specific than ""mechanical back pain"".

* Pain in lower back, roughly from the base of the spine to halfway up
* Pain is more towards the ""sharp"" end of the scale than ""aching""
* Pain is worst when I wake up, after I've walked / stood up for a while, or a while (say 15-20 minutes) after doing heavy lifting, but is more or less constant the rest of the time.
* Feels to me like my vertebrae are all squished up - like I want to be a couple of inches taller
* If I lie over the edge of the bed (on my front) and stretch the spine, it gives relief (whilst simultaneously hurting, but it's  a ""good"" pain if you see what I mean).  Afterwards, I feel fragile, like if I moved too quickly it would really hurt.
* If I lie on my back and twist my hips it is somewhat relieving.  It also crunches each time I twist (sometimes it's one crunch sound, sometimes it's multiple, and I can feel the vertebrae slipping over one another when it happens)
* Occasionally I get sore muscles if I stretch too much, but the nature of the muscle pain is very different
* I've tried:
   - Amitriptyline (makes me sleepy, provides no pain relief)
   - Pregabalin (makes me feel high, provides very slight pain relief in high doses)
   - Codeine (45-60mg mostly dispels the pain for a few hours, but I don't really want an opiate addicition)
   - Cannabis (provides a distraction from the pain, but no actual pain relief)

My posture's never been great and I probably have a somewhat lower than average calcium intake, which makes me think it could be skeletal in nature.

I've been to the doctor many times, and had a couple of courses of physio, neither of which helped.  I'm posting here as a last resort, rather than a first attempt.

Any help / advice much appreciated...",
359,"Trapezius pain increasing, what's wrong?","I started getting pain in my upper back/lower neck between the shoulders area around mid december, I chalked it up to bad posture and tried sitting straighter. A month later now and it's become a daily pain.
I would rather not give up and just live on OTC painkillers until I have to have to pay for massage or chiropractic visits.
I know much back pain can be fixed by change in posture and stretches.
I've been doing that for several weeks, following all the reasonable advice I can online.
But the pain is increasing and spreading.
It's now shooting lower down my spine.
I really don't want this to become a life long chronic condition.
I'm a 29 year old female student, 5.1ft, 110 lbs.
It's becoming an issue that is interfering with my studies, it's very hard to spend hours reading and writing when I have to arch my back, shrug my shoulders tightly and pull my neck back every few minutes to hope to lessen the pain.
Hell, I've even given up sleeping comfortably, using the most neutral position with a very neutral pillow.
Is there something I'm missing?
There must be! I'm doing everything I'm supposed to do! I'm following all the best advice. I'm young and not out of shape, this HAS to be fixable!",
360,MRI results say LS &amp; L4/L5 disc desiccation with annular fissures. I'm an active (up until a couple months ago) 26F... advice on what to do now?,,
361,Car seat cushion recommendation?,Anyone have anything specific you like to use for car seat support? Or just any old cushion to 'flatten' out non tilting car seats?,
362,Upper back pain,"Hi all,

I developed upper back pain for the first time in my life after sleeping on an uncomfortable bed for months. I left the bed and it improved. But now if I lie in even a normal bed and lie propped up vertically on my pillows, in a sitting position in the bed, the pain comes back or gets worse

Obviously I can avoid this position but are there any other ideas for helping with the pain? It's upper back",
363,Herniated disc questions!!,"Hey guys!

So for the past year I’ve had on and off back pain, until I started my job in a supermarket in September and had really intense sciatica after a 9 hour shift constantly lifting fruit+veg crates all day long.

I found out from an MRI result this weak that I have a herniated/prolapsed degenerated disc at L5-S1.

My question: Is disc degeneration evident in most disc herniations? Or will I now have Degenerative disc disease my whole life? 

Really athletic 18 yo (soon to be 19) who has an interest in joining the Royal Marines, so naturally I am very concerned :-)

",
364,"Started a discord chat, for talking spine/backpain related challenges - feel free to join","Hey all, started a discord chat and wanted to throw an invite out to anyone who wants to join

All welcome:

[https://discord.gg/sqFdVfS](https://discord.gg/sqFdVfS)

I had a spinal fusion when I was younger and still can have underlying persistent challenge like sleeping, sitting, etc. 
",
365,Herniated discs/Sciatica help?,"So to start off I have been dealing with back pain for over a year now. I fell pretty hard down on my butt and have been dealing with awful sciatica and mid back pain since. I started off going to a chiro, helped a bit, but as soon as I quit going I was in terrible pain again. Waited a month or so, mind you, I’m in pain everyday, but one day my pain was worse than normal. So, I call up ORA (and orthopedic place in my area) and I get rushed in without having a doctors recommendation like they normally require. I get an MRI done, I have 4 herniated discs, and was told that my insurance required me to take 4 weeks of physical therapy and have 2 Cortisone injections, but that these would not help me and I should prepare to have surgery this year. I am currently waiting to have my second infection, but oh my gosh I am so sore everyday. What does everyone else do, to help them through the pain. I’ve tried walking it off, I have tried to just lie down, stretches from pt, the works. I just hurt so bad everyday from the moment I wake up, to the moment I go to sleep. 

Tl;dr I hurt like a mofo. ",
366,Found an exercise that triggers my back soreness. Should I do more of it?,"I'm recovering from a car accident about 3 years ago. My back is almost fine, but it aches just a bit in a way that I know it's not quite ok.

It feels like a muscle in my lower back (a PT said my QL, could be a spinal erector) is chronically tight.

The exercise is a [Landmine Rainbow](https://www.youtube.com/watch?v=OZiiRID_Zmg). Most other exercises, even heavy deadlifts, don't make it feel any different, but those really hit it.

My instincts tell me to do high volume, low weight regularly to strengthen the muscle, and maybe it will finally relax, but I've also heard a tight muscle like that usually means nearby muscles are weak, so focusing on those would be better.

Or I could stretch more, but QL stretches are annoying, and I've been lazy with them.

Probably should mention I'm halfway physically active, and I've been though over regular yoga sessions since the injury. Overtraining and not giving my back a chance to heal is a real possibility too.",
367,Having back pain for over a year. About 8 months ago I noticed that my left spinae erector is moving when I lean forward. Tell me what you think and your experience with this kind of stuff if you have any. I will post more details later on.,,
368,Newbie to back pain,"Hey, I've been luck to avoid back pain but over the past year I've started to get some fatigue / spasm / tightness in my lower back. 

It  comes on when I stand for 10+ minutes which seems bad considering I'm in decent shape.

Any suggestions on where to start with exercises or how to improve the pain?",
369,Back pain for over a year now. About 8 months ago noticed that my left spinae erector is moving when I lean forward. Tell me your thoughts and tell me have you seen this kind of stuff before. I will post more details later on.,,
370,24 f low back pain &amp; spasms,"Hello! It's been 6 months now that my left low back hurts practically all the time. I have trouble standing up, twisting &amp; lying down. Since it has been getting worse, I ve had an mri that didn't show anything, brief physio and now pain killers and muscle relaxants since I have had back spasms. I'm waiting for another physio session but I was wondering if anyone could help. Mostly about the back spasms. Thanks! ",
371,Back Mechanic success stories (especially athletes)?,"Hello fellow sufferers,

I'm about three months into a bulging L4/5 that's hitting a nerve, and I've been trying everything I can think of aside from surgery - PT, chiro, sports massage, dry needling, Muscle Activation Technique (MAT). While I generally feel pretty good, I teach and train in Brazilian Jiu-Jitsu (it's like wrestling), which is a very flexion-heavy activity, and even training/drilling very light produces nerve pain.

I happened upon Dr. McGill's work, picked up Back Mechanic, and have been doing the Big 3 religiously, along with revising everything else about how I sit, stand, get out of bed, off the toilet, etc., to be in line with what the book advises. Again, I generally feel pretty good, but my main goal is to get back to BJJ, and I'm disappointed that even light BJJ-related movement still produces nerve discomfort. 

You could say the purpose of this post is two-fold:

-To provide me a platform to complain as I sit here, with great posture, yet still in mild discomfort, feeling like I'm never going to be able to fully get back to my favorite activity in the world

-More importantly, to ask other active people/athletes who have experienced similar symptoms to share their stories and (hopefully) recovery using Dr. McGill's teachings

If this has already been done in another post on r/backpain, please feel free to point me to it, but I didn't see it if so.",
372,Neuromuscular Therapy for back pain,"I have been very successful working to relieve back pain using a technique called - Neuromuscular Therapy. When I was in IT I developed severe pain in my low back and hips. In seeking a solution I found Neuromuscular Therapy, it helped me so much I left my job in IT and became a practitioner. I don't make as much but the work I do is super rewarding. My practice is in San Francisco and I am always happy to answer questions. I offer free 30 minute sessions so people can come in to feel if what I offer is right for them. My website is here - canmt.com

I can't give specific advice over the internet and if you are in pain you should go and see your Dr first.

There are a lot of reasons for back pain one of the most common that I see in my practice comes from sitting to much. The hip flexors (psoas and illiacus muscles) get tight and stay tight and over time put undue strain on the lumbar spine and distort the lordotic curve. The upper body shifts back to compensate which increases the imbalance in the lower back. Many people who sit at a computer all day crane their head forward which distorts the cervical spine (neck) causing headaches and neck and upper back ache. The Neuromuscular Therapy that I practice addresses these imbalances by breaking up the held tension patterns and allowing the body to come back to a more neutral position. Along with the soft tissue work I address perpetuating factors with clients and offer simple self care ideas that help to keep tension from coming back.

There are three parts for lasting relief-

1. Soft tissue work - release of the holding patterns suck in the soft tissue breakup  fascial adhesions and release trigger points

2. Education - guided self awareness exercises, anatomy review

3. Simple self care exercises that help to relieve tension held in the body

I hope that this helps. There are Neuromuscular Therapists all around the country it just isn't as well know as other therapies.",
373,Are stretches supposed to hurt?,"I have a 9-5 desk job which has been causing me pain in my upper back. When I am not working, I am still typically on my laptop, either at my desk at home, or in my bed. 

2-3 days ago, I have started stretching my back a few times a day to attempt to reduce my upper back pain.

Here are the exercises I am doing:

1. [Cat and Camel](http://www.marinphysicaltherapy.com/files/exercises/v2/Thoracic.CatandCamel.pdf)
2. [Lumbar Extension](http://www.marinphysicaltherapy.com/files/exercises/Lumbarextensionexercises.pdf)
3. [Child's Pose](https://gfycat.com/SnarlingSecondHake)
4. [Open Book](http://www.marinphysicaltherapy.com/files/exercises/Thoracic-OpenBook.pdf)

The threads where I found the exercises: [1](https://www.reddit.com/r/DotA2/comments/5t4url/to_those_of_you_who_are_suffering_from_back_pain/) and [2](https://www.reddit.com/r/pcmasterrace/comments/59nvlf/found_the_solution_for_my_recurring_back_pain/). 


My back pain seems to have gotten slightly worse, and now my neck is slightly sore as well. 

Is this expected or am I doing the stretches incorrectly?",
374,"Hi there, I have chronic back pain. I've had surgery, injections, the works. I'm currently in the ER because a deep indentation formed over my right buttocks. It burns and I can barely move now. Anyone know what that could be?",,
375,How To Pop Your Neck 2 Ways Save Chiropractor Money By Learning This,,
376,Nucleoplasty Advise,"Hi All, 

My partner has Thoracic disc bulge. Does anyone have the same injury and has anyone had the nucleoplasty procedure done? 

Any help and guidance is highly appreciated 
",
377,"I was just diagnosed with herniated discs in my L4-L5 and L5-S1. I’m 34 years, 6’3”, 250lbs. I don’t want to have to undergo surgery if I don’t have to. I know losing weight will help a lot and I am working hard on that(down nearly 100lbs in 2 years). Any other advise?",,
378,Same issue,"Hi,

Just wondering whether you had the Nucleoplasty done on your back. My partner had the same issue and is considering nucleoplasty.",
379,I’m 35 years old with chronic lower back pain,"It hurts when I sit down. It hurts when I stand up. It hurts when I sneeze.  Getting out of a bathtub is sheer agony. I wake up with my hips feeling like they are on fire.  It’s all lower back pain, right above my butt.  What can I do?  I don’t have insurance and have never seen a doctor for this.   I sometimes lay on the floor and try to stretch but I’ve never been able to make it better.  Sometimes I get so depressed living with this pain! I would love any advice. I’m 35, male, 5’8 180 lb. ",
380,How is my lower back? / MRI translation needed,"Brief history - about 16 years ago (at 26 years old) had bad lower back pain for a few months with sciatica on the back of my left leg.  Went to a back doctor and got an x-ray done, here is his diagnosis:

1. Disc Degeneration Disease

2. Retrolysthesis on L4-5?  I don't remember the exact vertibrate.

Went to 2 different Physical Therapists and it did not help - finally the back pain went away on its own about 8 months later.

.

Throughout the years I would get some back pain every 2-3 months and it would last about 2 weeks.

Sometimes its my lower back muscle (this is usually more soreness and pain associated with stiffness).  

Sometimes its my ""spine"" - I feel the pain coming from my spine rather than my muscle and for example if I sit and totally relax my body (dead weight) I feel like someone stabbed me in the spine.  And I sometimes get a shooting pain into my testicles.

.

Finally went back to the doctor last month and he ordered a MRI, this is the test results (have not been able to go back to the doctor):

.

Impression:  A transitional lumbosacral segment is referred to as S1:

1. Midline posterior disc herniation at L4-L5

2. Marked disc space narrowing at L5-S1 associated with a posterior disc-osteophyte complex encroaching upon the canal and neural foramina, left more than right
.

Can someone translate that into layman's english.

How is my lower back? (in your opinion, which I understand is just a internet opinion based off a short post with no examination)

I didn't think my lower back was that bad, yes I get back pain, but it only lasts for 2 weeks and its about every 2-3 months so its not that constant.  

But the report sounds kind of bad.  (I do know that just because there is a disc issue does not mean there will be pain.  I know people can have herniations without symptoms)

That said, I am surprised at the herniation.  I didnt think I would have one, I thought perhaps a bulge at most.


Thank you!
",
381,Very informative,,
382,How to search for a doctor for back pain ?,"Hi, I have been having backpain for over 9 years and I have recently joined Kaiser. I have visited doctors before who've told me just to reduce my tummy. Recently the pain in my right toe has become bad. Constant ""bunch of needle"" pain. Can someone tell me how do I search for the right doctor to diagnose my condition ? Whether it is herniated disc or sciatica etc.
Thanks.",
383,Stem cell therapy for degenerated disks,"Hi Just wondering if anyone has any experience with stem cell therapy for degenerated disks? I have read that it has a good prospect of success and low risks but is very expensive. 

I would be willing to pay if I thought it was going to work, but I have also heard there are problems with the treatment being used for disks (as opposed to knees for example) and wondering it may be better to wait a few years until it has been perfected... Has anyone tried it? (I have so far only spoken to one person who had, and they said it did nothing) 
Thank you :)",
384,Stretch helps lower back pain - Great video,,
385,lower back pain and in both thighs (18 yrs old),"About 3 - 4  years ago when i was 14/15 i had 6 lumbar punctures (unrelated to back pain) which were done all in the same day as they couldn’t get it in the right place.
Since then i’ve had lower back pain on and off, which i presumed was normal at first (they did say i would need physiotherapy however i was never given it).

Recently (about 6 months ago) the pain has been excruciating, and has spread down into both of my thighs. It results in me not being able to sit, lay or stand for any longer than 5 - 10 minutes without being in a great amount of pain. 

I have been to the doctors who just gave me Co-codamol and naproxen and sent me on my way and also to a physiotherapist who just told me to do Pelvic tilts until she can next see me (in about another 2 months). Neither of these two things have helped and i’m not sure what to do next.

The physiotherapist said she didn’t think the lumbar punctures solely caused the pain, however it may have triggered it. 

Any idea what might be going on here? Or what i can do to help with the pain? 

Thank you in advance ",
386,Know the name of Ironman Inversion Table to get rid of back pain,,
387,Couldn’t Move for 3 days,"Hi Sub reddit, just introducing myself i guess. Currently laid low with another lower back pain episode ! I had a sore lower back on Christmas Day and thought nothing had it. I was sent on assignment and drove 10 hours to work on 28th Dec - that wasn’t smart. I eventually had to drive back on 1st Jan and have been on my back since then in agony. Yesterday the doctor visited and gave me a muscle relaxant shot, some valium and Naproxen and Codeine. I can stand now for about 3 minutes before the pain returns. So at least i can wash and go to the toilet.

I will doing the lower back exercises once i have some more movement. 

Hope you all have a pain free 2018",
