,Titles,Posts,Author_Self_Descript
561,How can I prevent throwing my back out a 3rd time?,"I am 24 and maintain a pretty healthy weight (140 lbs at 5'8"") yet I've thrown out my back twice within 6 months of each other. The first time was far worse, I couldn't move an inch without pain and had to crawl to get around. After rest and several chiropractor sessions, I finally healed. I began changing my posture, the way I bend, and exercising more (mostly in the form of running, which I wasn't doing before). 
That's why I was shocked when I managed to throw it out again the second time just two days ago. This time is less severe, I am able to walk to get around at least and have already had one chiropractor session which has helped, but I need some advice on how I can improve my lifestyle and avoid this from happening again, at least for a long while. 

To add, both times I've thrown it I wasn't even doing heavy lifting. I was putting on a pair of pants/shorts while standing. Pathetic, I know. I've shown my chiropractor how I do this movement and he suggested I now sit on the bed for this action. 
Anyway, what else should I be doing differently? When exercising, what should I be focusing on to strengthen my back? I've read on here some people mentioning core workouts, is that the key? Besides curl ups, what can I do? I typically only ever do cardio work outs so I don't know much about strength training. 
Thank you.",
562,What to do,"Recently my posture has gone really poor what with sitting all day at a desk. Unforuntaly while lifting my heavy dog into the back of my car i got a bad pain in my lower back. Originally on the right had side, but not i can be anywhere across the lower back. Also the pain can be where the spine meets the pelvic bone. I bought some anti-inflammaotrys for the pain and it gives relieve. Ultimately I was hoping somebody could point me as to where to go to get this relieve.. a physio ? chiro? osteopath?

Thanks 

dex",
563,How do I get back to my normal activities?,"I'm a 22 year old female. I'm recovering from a stress fracture on the lateral aspect of L5. I've finally hit the 12 week mark. WOOHOO! My doctor said I'm free to do whatever my body allows me at this point since the bone is stable. 

However I'm noticing the small things I've done over the weekend kind of have my back screaming. I'm a server in a sports bar ( I was on light duty for the last 12 weeks) and tonight I picked up my first serving shift which lasted only 3 hours and I'm not feeling all that great. I didn't even pick up anything heavier than a drink tray. 

As I'm laying in bed that fracture ache is back. UGH. I also will get occasional nerve pain. 

How do I get back to normal!? Do I just keep on pushing through? If I do any less than what I'm doing now I'll be right back at where I was for the past 12 weeks. 

Any input would be nice. ",
564,Lower back pain past year,"I've had a good amount of lower back pain for the past year or so. I believe it all started after I sat in a chair at my corporate job for 12 to 14 hours a day during some months. I am 6 ft 3 inches, 190lbs, and 28 years old for reference. One day I was moving some boxes and may have lifted with my back slightly and I felt sharp pain. Unfortunately with healthcare the way it is I'm afraid to head to the doctor as I have a very high deductible and simply can't afford it.  I've since quit that corporate job and now work 9 to 5 (still sitting in a chair) in hopes that things would get better but they haven't. I feel the pain when I'm sitting or bending over in the lower back. I get a lot of relief when my wife massages my lower back or my glutes.

Please help. I am in good shape physically all considering. I've seen a chiropractor once who said he believes I pulled a muscle but that was 5 months ago and I would think they pain would have gone away by now.

Searching in this subreddit I've found McGill's stretches that I will now do religiously. Is there any other advice that doesn't include me spending lots of money?

Thanks and I love you guys
",
565,My back pain is going to make me want to kill myself,"I've tried everything. The last three years I have had increasingly crippling back pain, although doctors keep telling me I'm fine and normal. Every moment is just a degree of much it hurts, most times becoming crippling. I call off and leave early from work because even laying down hurts. I try to go to the gym but all it does is make it worse. I stretch daily, constantly am aware of my posture and I give myself as light of a load as possible but no matter what I am always in pain. I can't sleep because of it, I can't get out of bed because of it, I can't even drive without wanting to be in tears. I've hoped it would go away but it's only gotten worse, and is at a point that I can't have any life plans because of it. I never feel happy because everything is secondary to the constant pain I'm feeling. I don't know what to do. Pain killers don't seem to work anymore. Even laying down hurts. I'm losing money because I can't work, and I just don't know what to do. My life is completely halted by the constant pain. I don't have anything to live for in this kind of pain. It has completely taken over everything in my life.



Right now I'm pulled over on the side of the road in tears with my seat down having my back as stretched as I can because I couldn't take another second sitting up. I'm a delivery driver and I can't even do my job anymore.",
566,"Lower back pain, please help","Hi guys, currently writing this post on my phone from bed pretty much unable to move. 

I have no history of back pain, am 25 years of age and work a fairly manual job. Around a week ago I had minor discomfort in my lower back, I assumed I was just achey from work or my mattress was awful. 

Continuing work as usual, half way through a shift something must have changed, suddenly I'm unable to bend over or lift things. Driving home was agony. I've since called in sick due to this and have seen a Dr... Prescribed Naproxen and Zapain which do absolutely nothing for the pain.

I'm writing this in the hopes someone has some advice for me, it's currently too late to see a doctor, but I plan on seeing one again to have a scan of some sort as I think this may be more serious than I initially thought. (And seemingly getting worse...)

Is there anything I can do in the meantime to prevent my situation getting worse? I've read about certain stretches and having hot water bottles etc but these don't seem to help either.

Thanks for reading.
",
567,Permanent back pain?,I've been developing severe back pain over the last few months that's only getting worse. I believe it to be as a result of sleeping on a stiff mattress all my life. I'm 18 and my back is getting to the point that everyday tasks are becoming incredibly difficult. Is this pain permanent or will it subside overtime with a new mattress?,
568,Good ergonomic chairs?,"Hey guys. About a year ago I had a muscle spasm in my lower back and since then there have been times where the pain comes back around every 6ish months. It sucks, but I deal with it, and I'm seeing my doctor about it next week.
Anyway, right now I'm using a really shitty office chair and need something that's better for my back. I'm 6'1"" so I'm looking an ergonomic chair made for tall people and maybe somewhere in the ballpark of under $500 CAD. Recommendations would be much appreciated!",
569,Chronic Back Pain App - game changer?,"Cathryn's book Crooked (https://aeon.co/essays/to-treat-back-pain-look-to-the-brain-not-the-spine) is a getting a lot of attention.

I just wondered if there was an app, which help you train your mind away from pain, people would be interested in signing up. There's so many apps for mindfulness (Headspace etc.) and fitness (Freeletics), having suffered from back pain for so long I've seen real improvements in training the brain away from pain.

Would people be interested in something like this?",
570,NSAIDs ineffective but alcohol effective. What type of back pain is this?,"Most people who have backpain say they get relief from Advil or Naproxen, but I never really have gotten much help from them (nor curcumin, nor CBD oil)

Muscle relaxants help a bit. So far everything points to imbalances / tired hip stabilizers / slightly crooked pelvis. Massage helps. 


I just want to know why alcohol and massage help but traditional NSAIDs do not. What do you call back pain that is not caused by inflammation? What else could work?",
571,"Discomfort in my back, middle, right side.","Ok so this the story. Last 3 days i was laying in bed 80% of the time. And it started to feel weird in my back, middle, right side. It feels like it's inside, like in a right lung or behind my ribs. From 1-10 i would say pain is 2. I can't even call it pain. It's more of a discomfort. I feel it the most when I lay on my back or on right side.  Have you ever encountered with that? ",
572,Woke up to incredible si-joint pain,"Hi.

This happened several months ago, but I decided to post this one since I will soon get blood results for a possible rheumatism so it's a timely topic.


At one morning in May, I woke up mid-sleep. It was early in the morning. First it felt like I had eaten something bad the night before - this slight burning sensation in my groin and stomach. Once I got up from my bed though, oh boy was it a hell ride!

The most intense pain I could know of had settled up in the right si joint of my lower back. It was an excrusiating pain - I couldn't lay down, I couldn't sit, I couldn't stay up, for nothing could lessen the pain that I was feeling. I looked to the mirror and the large back muscles above the si joint where cramping. My face went white from the pain and I had this cold sweat as I took a prescription pain relief (Panacod, which was originally prescribed for my monthly migraines) and headed to the nearest pharmaseutical, which was over half a kilometer away. There had been one just around the corner around a year ago, but it had closed down. Damnit!

I had to sit down to rest at times, as I made my way to the pharmaseutical. I felt myself incredibly old, shouldn't these kind of problems be reserved for the old age? And what the hell was this pain anyway? I arrived to the drug store and sat down to a chair to wait for someone to come and help me. Which to my surprise, no one did. The store was now empty but no pharmaseuts approached me, on the contrary, they had retreated behind the desk to small chat amongst each other.
That's when I understood it - I probably looked like a drug addict in withdrawal. Pale face, sweating and trembling. I went to the desk to ask for help. At this point my voice was constantly breaking, out of sheer pain and I was close to fainting. She gave me some cold gel (those for sport injuries) and anti-inflammatory lotion for the muscle.

I headed to the nearest toilet and applied one of them. As I was heading back home, Panacod had already started to do its thing and I was more and more numbed to the pain. I went to sleep and slept for around 2 to 3 hours. When I woke, I was surprised to find that the pain had gone away.

Still, for the next week my si joint had a habit of aching. The first few days were the worst - I would sit at my computer for around an hour, and it would start to ache. It went to the point where I had to take a break and do some back relieving movements as the pain was starting to become too intense.

The ache dissipated after a week, but even to this day the si joint has a habit of making either a slight burning sensation or tingling from time to time. Sometimes there's a quick pain sensation when I make a wrong move, after a long period of sitting. Still, it goes away instantly.

What do you think of all of this?


TLDR; Intense pain at si joint upon waking up. Was aching for a week or so. After that, only burning sensation and tingling at si joint from time to time.",
573,When is it time to ask if you've had a failed surgery?,"I am 14 months since my spinal fusion at L5-S1. The last several weeks have seen the re-emergence of some very familiar pains and sensations. I know, I know, a single level fusion is quite mild compared to other back surgeries. And I am lucky, I had immediate nerve relief, even if it took extensive rehab for me to leave the hospital. I don't know what kind of history or context is needed here, so I will try and give you guys a summary of my journey thus far. 

January 2015, I am moving a 90in TV at work down some basement stairs. I know how it sounds but the TV in question was quite light, it just took my full wingspan to grasp it. I was an AV installer for a large company for six years. I was on the top going down s tiny flight of outdoor basement stairs. I obviously had to bend a bit being on the top of the lift. With my wingspan completely open, I twisted just the smallest bit to one side, and immediately felt the shift in my body's internal mechanics. I knew something was wrong right away. No loud ""pop"" or anything like that. But when you use your body for a living and do these things thousands of times, you know immediately when something is wrong. I finish my work, report the incident, etc. End up on workers comp. we spent the time from February 2015-September 2015 years exhausting any and all conservative treatment options (aside from alternative treatments comp would never cover.) Multiple injections, months of PT. Plataued in progress around April or may of that year. Brick wall, not getting better, barely managing to keep the progress we found in PT. Two epidural injections (waking up on the table during the second one sucked pretty bad) and the second round almost seemed to agitate the area worse. My MRI in that spring showed a fairly nasty herniation at L5-S1, with a negligible herniation directly above. By August 2015, we finally decided to start meeting with surgeons. I'll skip the workers comp nightmare, but after a lot of shenanigans, I finally found a fantastic neurosurgeon in May... of 2016. Almost a year after deciding on surgery, and close to 18 mos post injury. After very in depth talks with my surgeon, we decided the more aggressive procedure of a single level fusion was best, given success rates of single level fusions, and my young age (I was 27 by this point.) Surgery went well, some minimal anesthesia complications afterwards, but nothing too threatening. Recovery was extremely slow, maybe because I had spent close to two years stuck at home (yay, works comp :/) I continued PT and felt a bit stronger for a while, as the bone continued to fuse and show nicely on periodic x rays. I was discharged via an independent medical examination by a dr of WC's choosing. Basically a quack to discharge me from care ASAP to reduce cost. This, however it my benefits, and cut me from further visits with my ACTUAL neurosurgeon who performed the surgery. I am still experiencing a lot of localized pain at the time my one year check up was supposed to be, but I was informed further visits and testing would not be covered. I never got to voice my concerns with my surgeon properly. 

So, I've given it a few months and continues some weeks of PT before that was of course cut off. I am no where near the strength or mobility I was at before the injury.  However, as I said, the bone has fused very well according to x rays. That said, the x rays do not account for soft material like disks. So I have not had an updated MRI since the spring of 2015. Of late, I've been experiencing occasional (escalating in reoccurrence) radiating nerve pain in a similar area as I was before surgery. Definitely not the same exact position, but very close. This is on top of general weakness of the core due to lack of activity pre op, and post op pain never really reducing enough to allow normal activity to pick up again. I'm fearing the worst at this point. The signs I'm seeing lead me to believe the negligible herniation above the fused level has deteriorated, or began doing so and is no longer negligible. My sleep has always been an issue, before and after surgery, but lately I can't even lay down in my bed without being miserable. Never mind getting a restful nights sleep. You can imagine how that affects every other aspect of life. 


Have any of you had similar experiences? Am I worrying about nothing? I want nothing more than to never even see a pain pill, muscle relaxer or nerve related medication again. I was sure a year into this after surgery I would be nearly back to normal. I am much better to a degree, but seem to be trending back downhill. What are your thoughts and experiences on this! Any advice? Similar stories? I turn 30 about a year from now, and all I've wanted is to be able to return to Brazilian jiu-jitsu by that milestone. I'm seriously doubting that at this point though. 

Thanks, if you made it this far. 

TLDR; 14 months post op lumbar fusion. Symtompatic and far from pain free. ",
574,Pain in lower mid back,"So I'm 19 and at university, seeing a chiropractor once every two weeks for standard readjustments. I was there only 4 days and have already started experiencing pain again in the lower middle part of my back. It only stars hurting when I'm standing up for 20 minutes or more which isn't much. I've tried to get a closer appointment but can't, any temporary solutions or ideas to help me out for the time being? ",
575,Lower back pain for over a week,"So last Sunday I bent over and all of a sudden I felt a sharp pain in my lower right back. Ever since I've had the pain that gets better and then I move the wrong way and gets worse again. I've been using heating pads, baths, Advil, and yoga (seems to help but I'm not sure) to try to lessen the pain. Should I go to a chiropractor? What should I do? ",
576,What type of mattress is best for back pain?,,
577,Post Surgery Pain,"Hi All, 

My name is Joe I'm 19 years old and I'm recovering from a surgery 8 months ago that repair a fractured L4 in my lower back. Since the surgery I've felt a lot better and quality of life has definitely improved. The only occasional problems I get are tightness and stiffness from The weather and being on my feet for extended periods of time (I'm a manager at McDonald's). when I get like this my brace helps a bit but when I take Tylenol, Alive or Advil I tend to get dizzy. Does anyone have anything that might help with this?",
578,Need help back pain,"Hey guys I'm not sure what to do here.
It all started when I started riding a bike that was two small for me a couple weeks ago, during that time O had to throw out my mattress as well and I've been sleeping on a hardwood floor.

MY middleback is tight.
So tight it really fucking hurts.

Do you guys have any advixce? I've been stretching, but I'm not sure what else I can do.",
579,Electric shock sensation in back,"Hi,

I was diagnosed with a C4/5 herniation earlier this year, which is mostly manageable with with meds (gabapentin and, when needed, tramadol).

However, over the last few years I've gone through periods where I've had difficulty sleeping as I'm constantly woken up by what I can only describe as an electric shock sensation beneath one of my shoulder blades that repeats every five minutes or so. This is followed by a few minutes of feeling tense/anxious. If I get up and wander around it doesn't recur, but starts up again once I lay down.

It's never been that much of a problem until the last few nights, when I'm now getting this sensation down the muscles along one side of my spine. I've had very little sleep and it's gone way beyond being the occasional inconvenience it once was.

Has anyone else experienced this and, if so, have you found a way to alleviate it?",
580,Upper middle back pain,"Hi all. This is my first time posting to this sub. Didn't even know it existed. 

That's not the problem though. I have been having intense back pain in my upper middle back, between my shoulder blades. I tried cracking my back, but that only helps for so long. I try constantly stretching, but it's the same problem. 

I started a new job a few days ago where it is standing on my feet for 8 hours, in one spot. 

I also have another job that I have part time, 5 hours a night, where I am constantly moving and barely stop. I have pain during that job too, but it's not as bad. 

Any suggestions on how to stop this back pain?

I have used ibuprofen, and I have a foam roller. I tried using both, but the foam roller made everything worse. 

If anyone can help this situation I would greatly appreciate it. ",
581,Lowerback pain while sitting?,"My lowerback starts to ache after about 10mins after sitting. Got IFT for 2 weeks and that was of no use.
Took muscle relaxants and started stretching my hamstrings by bending forwards and backwards 10times each 3 times a day. Great improvement but as soon as i stopped taking muscle relaxant pills the pain was back, though was much lesser than before. Now after 5 days from stopping the muscle relaxant back pain is killing me again.
The pain only comes when i sit. What to do?

Ps- Switched 4 doctors/ 3 of them were milking money 


#helpme

Edit-  I used to play CS a lot and sat all day. I have this pain from the past year. 
Currently doing a few exercises which the 4th physio recommended

Weight-82. Height-5’11. ",
582,Don't understand why I'm hurting all of a sudden,"So I'm 25 and for some reason have back pain. Now I had back pain when I was younger, around high school. What would usually happen is if i exerted myself near exhaustion then my back would ache and I would just rest up and be better within a day or two.

Still this was suspicious so I went to the doctor and had X-rays done and neither the doc or the expert at the lab saw anything. Still the problem pursed and yet again, a year later I went to the doctor, had X-rays and still nothing.

So fast forward to a couple of months ago, first day of summer I went to play basketball as I normally do, and the following day my back was in awful pain, like I couldn't stand let alone walk. 

I went to the chiro that day. I got a back brace and some heat and I was a little better. The chrio had X-rays done and discovered I had acute scoliosis (fuck the doctor) anyway I did some adjustments and learned some stretches and it's a little bit better. BUT I am nowwhere near what I used to be. What is wrong? It can't just be the minor scoliosis? I can't walk to far without my back hurting?

I haven't been back to the chiro because a couple of adjustments in and he started adjusting my neck and I got serious whiplash and vertigo. Which then led to a host of other issues.

Anyway, what can I do to return to my normal self? ",
583,Taking an 8 hour flight a week after my back went out. Advice and opinions?,"This was me under a week ago: https://www.reddit.com/r/backpain/comments/6xl73n/woke_up_in_agonizing_pain_frustrated_and_fatigued/

Today, having taken no hydrocodone in a few days and feeling in much less pain (probably in part because of the epidural I'd had the same day as my episode) we're considering going ahead with our trip to the U.K. on Tuesday. With the diminished pain and several days of rest mixed with walks and some of the McGill stretches I feel more confident about having a good time on the trip. Additionally, I've been prescribed gabapentin for the pressure being exerted on my nerve, causing some numbness in my foot and big toe. 

My lingering concerns are surrounding the long flight and having to be seated for a lot of it (I'll get up and walk around every so often) along with the new fear I live with of having an acute episode again. Because it's the first time it has ever happened and it occurred upon waking up, Im nervous it could strike again. Am I correct to believe that with the care I'm now taking and with proper lifting of objects, posture, etc. I should most likely be ok, even in the short term?

If I sleep seated on the flight will I risk waking up with some serious issue again? Should I just try and stay awake and move every half hour instead? I'm new to this ""throwing my back out"" thing and so I'm just trying to learn what I can from others. I know everyone's different and has their own triggers but figured I'd ask anyway. Thanks!",
584,Need help,"HI reddit. Yesterday I bent over to pick something up and i heard a loud pop in my muscles and felt it too, followed by a sharp pain in the area i felt it in. Now I can't sit down or bend over without it hurting. 

My parents won't get me a doc appointment and they're just rubbing lotion on my back. 

What could it be?",
